Name,Path,Position,Is Active,Url Key,Description,Image,Page Title,Meta Keywords,Meta Description,Include In Menu,Display Mode,CMS Block,Is Anchor,Availabe Sort By,Default Sort By,Page Layout,Custom Layout Update
Wicker Cabin Furniture,Default Category/Products,124,No,wicker-cabin-furniture,"<p>Revel in the spirit of a quaint country lodge with our exclusive outdoor wicker cabin furniture. Your rustic resort will be accented with the true natural essence of our wicker cabin furniture collection. Like the solid oak trees, our durable wicker cabin furniture is constructed to remain sturdy throughout seasonal changes. Our powder-coated, aluminum frames will remain strong and are eco-friendly. Our company&#039;s exclusive in-stock fabric inhibits colors from fading and our RAUCORD resin will not crack, chip, peel, splinter or absorb moisture. Customize your wicker cabin furniture by selecting resin finishes and fabric colors reflecting the essence of the lush forest. Cozy up to your wicker cabin furniture sets while knowing moments shared in the great outdoors will be cherished memories.</p><p>Our outdoor wicker cabin furniture will meet all of your exterior needs whether you&#039;re decorating your patio or hotel courtyard. We ship our wicker cabin furniture across the continental United States and offer assistance for any large hospitality order. Our sales representatives are highly trained to assist you throughout the purchasing process. Ask about adding wicker cabin furniture accessories to create a charming atmosphere on your patio or resort poolside. Discover the soft shade under the canopy of our umbrellas and tailor the color to match your wicker cabin furniture.</p><p>Ordering our wicker cabin furniture is easier than booking a room at the lodge, simply click the &quot;buy now&quot; tab or contact our knowledgeable and professional staff at <a href='tel:18442728826'>(844) 2-RATTAN</a>. Have your outdoor wicker cabin furniture questions answered by email at <a href='mailto:sales@rattanoutdoorfurniture.com'>sales@rattanoutdoorfurniture.com</a>.</p>",,Wicker Cabin Furniture,"Wicker, Cabin, Furniture, Outdoor",Revel in the spirit of a quaint country lodge with our exclusive outdoor wicker cabin furniture.,No,Products only_AND_Static block only,,Yes,,,No layout updates,
Wicker Cafe Sets,Default Category/Products,125,Yes,wicker-cafe-sets,"<p>Turn your outdoors into a quaint street side cafe, with our wicker cafe sets. Irresistibly charming and durable against the toughest of seasonal elements, our wicker cafe sets display elegance while conveying the strength of highly sought after, high-density, powder-coated aluminum frames and Viro rattan resin. Our outdoor wicker cafe sets add luxury and class to every porch and patio. Seat family and friends around our wicker cafe sets for friendly conversation, or enjoy the sound of the ocean waves on your beachfront property. Cherished moments are easily made with wicker cafe sets arranged throughout your backyard or garden. Customize outdoor wicker cafe sets designs for your eclectic home and choose from our stylish in-stock collections or create your very own.</p><p>Wicker cafe sets are ready to breathe new life into your next gathering and you can add our striking accessories to truly enhance your wicker cafe sets. Our umbrellas over your outdoor wicker cafe sets create a dine al fresco ambiance. For restaurants and designers, our cafe sets are leading the market in customer satisfaction and we cater to your requests by customizing our wicker cafe sets to coordinate with your existing decor. Your wicker cafe sets are just a click or phone call away at <a href='tel:18442728826'>(844) 2-RATTAN</a>. You can also send all your wicker cafe sets questions to our accessible email at <a href='mailto:sales@rattanoutdoorfurniture.com'>sales@rattanoutdoorfurniture.com</a>. Ask about our quick shipping options for all your wicker and rattan furniture needs.</p>",chairs.jpg,Wicker Cafe Sets,"Wicker, Cafe, Sets, Outdoor, Furniture","Turn your outdoors into a quaint street side cafe, with our wicker cafe sets.",No,Products only_AND_Static block only,,Yes,,,No layout updates,
Wicker Chairs,Default Category/Products,126,Yes,wicker-chairs,"<p>Invite sophistication and comfort to your outdoors with our impressive wicker chairs. Stunning wicker chairs have luxury and resilience adding pleasure to any deck, patio, or porch with an endless selection to choose from. Sturdy outdoor wicker chairs are crafted from Rehau rattan resin and will maintain their attractive appearance years past our competition. Season after season, your wicker chairs will remain free of rust and vibrant, wrapped in Allure fabric and powder-coated aluminum frames. Find our striking in-stock wicker chairs with our amazing sense of style and design or customize by mixing and matching colors or patterns. Breathe in the fresh salty air with coastal themed wicker chairs finished in soft DACRON back cushioning or show your love of the modern with a bold burst of color accenting your surroundings. Our wicker chairs are known as a cherished, timeless piece in homes, restaurants and resorts across the country. That&#039;s because, we strive to make your outdoor wicker furniture collections last.</p><p>Choosing our company&#039;s furniture will begin to transform your outdoors, as our outdoor wicker chairs will be the center of all your outside gatherings. Turn your deck into a private oasis or welcome your guests with the comfort of contoured seating. We offer our wicker chairs at the lowest prices on the market, guaranteed and will answer all your wicker furniture questions when you call us today at <a href='tel:18442728826'>(844) 2-RATTAN</a> or email us at <a href='mailto:sales@rattanoutdoorfurniture.com'>sales@rattanoutdoorfurniture.com</a>.</p>",chairs.jpg,Wicker Chairs,"Wicker, Chairs, Outdoor, Furniture",Invite sophistication and comfort to your outdoors with our impressive wicker chairs.,No,Products only_AND_Static block only,,Yes,,,No layout updates,
Wicker Cottage Furniture,Default Category/Products,127,No,wicker-cottage-furniture,"<p>You&#039;ll never be far from the quaint rolling hills of the countryside with our outdoor wicker cottage furniture. We take pride in our products and you will be able to see the detailed design complete with our resilient Viro resin finish. When you purchase our affordable wicker cottage furniture, you get excellence along with style. Each piece is equipped with 100% hand-woven, wicker strands and durable, all-weather, powder-coated, high-grade aluminum frames, enabling your outdoor wicker cottage furniture to holdup to the most extreme of weather conditions Upgrade the look with our fade minimizing and moisture resistant Sunbrella fabrics, and your wicker cottage furniture will bring you joy year after year.</p><p>Whether your house has a steel roof and a white picket fence or you live in a high rise above the city streets, outdoor wicker cottage furniture will encompass you in both comfort and class. Make your resorts, cruise lines, and restaurants feel cozy and warm with wicker cottage furniture customization options. Tint your upholstery and surround your wicker cottage furniture with deep seated cushioning. From tables and chairs, to sofas and sectionals, each collection is tailored to your liking, or you can pick the quick shipping option of our exquisite in-stock wicker cottage furniture.</p><p>Outdoor wicker cottage furniture is never far away with our online purchasing. You can also contact us by calling <a href='tel:18442728826'>(844) 2-RATTAN</a> or send an email to <a href='mailto:sales@rattanoutdoorfurniture.com'>sales@rattanoutdoorfurniture.com</a>. We are ready to make you the proud owners of our exclusive outdoor wicker cottage furniture.</p>",,Wicker Cottage Furniture,"Wicker, Cottage, Furniture, Outdoor",You'll never be far from the quaint rolling hills of the countryside with our outdoor wicker cottage furniture.,No,Products only_AND_Static block only,,Yes,,,No layout updates,
Wicker Couches,Default Category/Products,128,No,wicker-couches,"<p>What better way is there to enhance your outdoor collection than with some wicker couches? The more people you know, the more sitting room you&#039;re going to need for your outdoor social gatherings, so add a few of our wicker couches to ensure that there&#039;s a spot for everyone. Our vast array of wicker couches can be placed virtually anywhere outside, whether that&#039;s in a courtyard, on a deck, or at a vacation resort, and are bound to leave a lasting impression with friends, family, and guests. Peruse our assortment of wicker couches for your outdoor arrangement and find wicker couches that exhibit what a gracious host you are.</p><p>Our wicker couches are designed to fit all sorts of styles, but it should also be noted how safe and reliable they are. Each of our wicker couches are hand-woven by master craftsmen with all-weather, high-density, polyethylene RAUCORD resin and supported by rust-proof, powder-coated aluminum frames. We even like to make sure that the Allure fabric resists UV rays to minimize color fading, so rest assured with the knowledge that there will be no extra painting, staining, or other maintenance required, as we design our wicker couches so that they&#039;ll practically last forever.</p><p>How can you go about ordering one of our outdoor wicker couches right now? It&#039;s as easy as calling <a href='tel:18442728826'>(844) 2-RATTAN</a> or reaching one of our expert associates at <a href='mailto:sales@rattanoutdoorfurniture.com'>sales@rattanoutdoorfurniture.com</a> and telling our staff which wicker couches you would like. To serve you as quickly and conveniently as possible, we ship all wicker couches within 24-hours of purchasing.</p>",,Wicker Couches,"Wicker, Couches, Outdoor","What better way is there to enhance your outdoor collection than with some wicker couches? The more people you know, the more sitting room you're going to need for your outdoor social gatherings, so add a few of our wicker couches to ensure that there'...",No,Products only_AND_Static block only,,Yes,,,No layout updates,
Wicker Deck Furniture,Default Category/Products,129,Yes,wicker-deck-furniture,"<p>Curl up to our wicker deck furniture and enjoy late night talks on our luxurious collections without ever leaving your house. Discover the treasure of the morning sunrise on our in-stock wicker deck furniture sets and listen to the sounds of the ocean with comfortable contoured seating. Tailor quality wicker deck furniture to your needs by piecing together contrasting welting and cushion colors. Entice your guests with your seaside deck experience on a stylish dinner set and celebrate every summer evening with our customized Hawaiian themed wicker deck furniture. Look for traditional wicker deck furniture with wide arms or add modern class through subtly angled curves. Our outdoor wicker deck furniture is essential to any deck, providing the comforts of home while being surrounded by nature&#039;s sweet serenade.</p><p>Our wicker deck furniture opens your eyes to a new outdoor haven, made with durable materials such as our powder-coated, light-weight aluminum frames to withstand the elements. Even when exposed to the moisture, the salty ocean air or the hot, unforgiving sun, our wicker deck furniture is resilient. We want your outdoor wicker deck furniture purchase to be a lasting investment, which is why customer satisfaction has always been our number one goal. We will place all of your customized wicker outdoor deck furniture orders or choose from our in-stock selection, and all items are shipped immediately.</p><p>Call us today at <a href='tel:18442728826'>(844) 2-RATTAN</a>, and have all of your outdoor wicker deck furniture questions answered or email us <a href='mailto:sales@rattanoutdoorfurniture.com'>sales@rattanoutdoorfurniture.com</a>.</p>",products.jpg,Wicker Deck Furniture,"Wicker, Deck, Furniture, Outdoor",Curl up to our wicker deck furniture and enjoy late night talks on our luxurious collections without ever leaving your house.,No,Products only_AND_Static block only,,Yes,,,No layout updates,
Wicker Discount Outdoor Furniture,Default Category/Products,130,No,wicker-discount-outdoor-furniture,"<p>Are you looking for affordable outdoor furniture? Our wicker discount outdoor furniture unites quality outdoor furniture with the lowest prices in the business. Enjoy contoured sofas, sectionals, and tempered glass table tops without the worry of bursting your budget. Turn your outdoor patio into a trip to the tropics with our Tiki dining sets accented in optional grass green upholstery, or catch an ocean wave on your beach club&#039;s sundeck with our coastal wicker discount outdoor furniture. Comfort and functionality is our main objection and our wicker discount outdoor furniture is designed to display class as well as withstand the most extreme of weather conditions. Our wicker discount outdoor furniture incorporates cozy high resilient (HR) foam-seating, sturdy rustproof frames and tightly woven RAUCORD wicker.</p><p>Are you a unique country club, resort, restaurant or home owner looking to customize your wicker discount outdoor furniture? Our wicker discount outdoor furniture can be customized to meet your style and decor. Start from the ground up with our knowledgeable and expertly trained staff who will guide and work with you to achieve your designing goals and finish with ordering a one-of-kind wicker discount outdoor furniture set sold at the lowest available price. Order from our in-stock wicker discount outdoor furniture and receive our quick shipping options.</p><p>Order your wicker discount outdoor furniture today online, or give us a call at <a href='tel:18442728826'>(844) 2-RATTAN</a>. We will promptly respond to all emails sent to <a href='mailto:sales@rattanoutdoorfurniture.com'>sales@rattanoutdoorfurniture.com</a>.</p>",,Wicker Discount Outdoor Furniture,"Wicker, Discount, Outdoor, Furniture",Are you looking for affordable outdoor furniture? Our wicker discount outdoor furniture unites quality outdoor furniture with the lowest prices in the business.,No,Products only_AND_Static block only,,Yes,,,No layout updates,
Wicker End Tables,Default Category/Products,131,Yes,wicker-end-tables,"<p>If you&#039;re looking for high-quality, beautiful wicker end tables to add to your outdoor furniture arrangement, you&#039;ve certainly come to the right source. Our company provides an array of wicker end tables that can be utilized in a mixture of settings. Want to add wicker end tables to your sundeck so that you can display a few potted plants? Go for it! Our wicker end tables will serve virtually any outdoor purpose you can imagine.</p><p>Constructed from rustproof, powder-coated aluminum frames that you can depend on and hand-woven from all-weather, high-density, polyethylene RAUCORD resin, our wicker end tables are prepared for anything and will endure for years regardless of adverse weather conditions. Even the tops of our wicker end tables are made from tempered glass to rule out any chances of shattering.</p><p>Do our wicker end tables require any additional maintenance from you, the customer? No, as the polyethylene prevents the cracking or peeling that require wicker end tables from other companies to be painted or stained over time. Our classy wicker end tables will be shipped directly to your chosen location without needing any extra assembly from you. If you&#039;re ready to order one of our wicker end tables now, call <a href='tel:18442728826'>(844) 2-RATTAN</a> or send an email to <a href='mailto:sales@rattanoutdoorfurniture.com'>sales@rattanoutdoorfurniture.com</a>. You will receive wicker end tables within 24-hours of completing your purchase. Our knowledgeable associates are waiting to assist you with any of your outdoor furniture needs.</p>",,Wicker End Tables,"Wicker, End, Tables, end, tables, Outdoor, Furniture","If you're looking for high-quality, beautiful wicker end tables to add to your outdoor furniture arrangement, you've certainly come to the right source.",No,Products only_AND_Static block only,,Yes,,,No layout updates,
Wicker Essentials,Default Category/Products,132,Yes,wicker-essentials,"<p>Start browsing today for one-of-a-kind wicker essentials products and completely transform your home. Crafted from the hands of master artisans, our wicker essentials are the epitome of prime construction. Using the industry&#039;s leading materials, our outdoor furniture products consist of a line of meticulously detailed wicker sectionals, loveseats, chaise loungers, dining sets and accessories alongside a wide array of designs, styles and color choices. Create conversation on your patio, deck or poolside by placing wicker essentials all along your exterior. Hosting summer parties has never been easier and your guests are sure to enjoy the pure leisure of plush wicker essentials. Whether customize or in-stock, dynamic wicker essentials and our rattan outdoor furniture depict the essence of your surroundings and highlight the heart of any home.</p><p>Superior materials are always priority when handcrafting durable wicker essentials. Each product is individually detailed to depict beauty while also sustaining its strength against the elements. All-weather Rehau wicker resin is tightly woven onto rustproof, high-density powder-coated aluminum frames. Although soft to the touch our Allure fabrics retain their resistance to moisture absorption and inhibit sunlight damage. All year round, your wicker essentials will continue to appear vibrant and ready for use.</p><p>Our team of operators are standing by awaiting to take your call at <a href='tel:18442728826'>(844) 2-RATTAN</a>. Whether you need assistance with your online outdoor furniture order have questions we also take emails sent to <a href='mailto:sales@rattanoutdoorfurniture.com'>sales@rattanoutdoorfurniture.com</a>. Enjoy the convenience of ordering wicker essentials at the lowest prices on the market.</p>",,Wicker Essentials,"Wicker, Essentials, Outdoor, Furniture",Start browsing today for one-of-a-kind wicker essentials products and completely transform your home.,No,Products only_AND_Static block only,,Yes,,,No layout updates,
Wicker Furniture,Default Category/Products,133,Yes,wicker-furniture,"<p>Just by glancing at our outdoor wicker furniture you&rsquo;ll see why we continue to lead the furniture market. Listed at the lowest prices on the market, all of our products are constructed with innovating materials. Our exclusive Allure fabric inhibits your wicker furniture from UV damage as well as stops moisture from absorbing. Viro wicker resin is crafted for low-maintenance and cleans easily with soap and water. Each sturdy high-density, powder-coated aluminum frame is designed for your outdoor wicker furniture to remain rust proof. However, durability is just the beginning as you browse through our online swatch book and coordinate color combinations for your textiles and wicker finishes. Add contrasting welting to all of your wicker furniture cushioning or go for a traditional neutral color blend. Become enamored by the excitement of the outdoors season after season, and discover what our valued customers already have, our wicker furniture is superior from top to bottom.</p><p>Wicker furniture is a commodity in homes, beach clubs, hotels and resorts throughout the United States. We offer quick shipping options for all in-stock outdoor wicker furniture collections, or you can customize your pieces online. Choose tables, chaise loungers or sofas and tailor them with optional patterned Sunbrella fabric and the use of DACRON wrapped back cushioning. Our expertly trained staff is willing to address your wicker furniture questions and assist you with your online purchase at <a href='tel:18442728826'>(844) 2-RATTAN</a> or through our email at <a href='mailto:sales@rattanoutdoorfurniture.com'>sales@rattanoutdoorfurniture.com</a>.</p>",,Wicker Furniture,"Wicker, Furniture, Outdoor",Just by glancing at our outdoor wicker furniture you'll see why we continue to lead the furniture market.,No,Products only_AND_Static block only,,Yes,,,No layout updates,
Wicker Furniture for Sale,Default Category/Products,134,No,wicker-furniture-for-sale,"<p>Wicker furniture for sale is available right now on our easy-to-use website or by contacting our sales team. Finding quality wicker furniture for sale has just got a whole lot easier because we sell all of our collections at the lowest price on the market, &quot;guaranteed&quot;. From looking at swatches online to discovering our wide collection of tables, chairs, sectionals, and sofas, our wicker furniture for sale is fun to explore. Easily turn any house into a home when you purchase our high-quality and long-lasting wicker furniture for sale. Tell stories with our rockers, sofas and lounge chairs gathered around an outdoor fireplace. All discounted wicker furniture for sale will create the quiet and inviting environment you have been searching for.</p><p>Worried about the quality of our outdoor wicker furniture for sale? Our outdoor furniture is made with highly-durable materials like all-weather, powder-coated, high-grade aluminum frames and pliable, high-quality, high-density, polyethylene RAUCORD resin. Our outdoor wicker furniture for sale will not crack, split, stain, or unravel. The bright colors of your cushions and the shine of your finish will remain vibrant no matter what the forecast brings because our wicker furniture for sale comes standard with our exclusive Allure fabrics. You&#039;ll find a wide selection of wicker furniture for sale keeping you a satisfied customer.</p><p>Want to know more about outdoor wicker furniture for sale? Talk to one of our experts by dialing <a href='tel:18442728826'>(844) 2-RATTAN</a>. We even have a quick response email service at <a href='mailto:sales@rattanoutdoorfurniture.com'>sales@rattanoutdoorfurniture.com</a>.</p>",,Wicker Furniture for Sale,"Wicker, Furniture, for, Sale, Outdoor",Wicker furniture for sale is available right now on our easy-to-use website or by contacting our sales team.,No,Products only_AND_Static block only,,Yes,,,No layout updates,
Wicker Furniture Online,Default Category/Products,135,No,wicker-furniture-online,"<p>Do you want to shop for outdoor products to adorn your space without having to leave your home? Find great wicker furniture online from our company! When you shop for wicker furniture online from our company, we offer you the most extensive selection of outdoor products on the market. Sift through a wide variety of outdoor stools, coffee tables, lighting, chairs, and more with the aid of our swatch book when you shop for wicker furniture online.</p><p>Every superb piece of our wicker furniture online can be depended on to serve your outdoor needs for years without cracking, chipping, or peeling, as the high-density polyethylene in our hand-woven Viro resin prevents such damage from occurring. When you purchase wicker furniture online with our company, you also get the satisfying, mind-easing knowledge that each of our outdoor products are constructed from light-weight, powder-coated aluminum frames, high-resilience (HR) cushioning, and UV-resistant Allure fabric. So if you had any doubts about ordering wicker furniture online, go ahead and put them to rest.</p><p>Worried about viewing wicker furniture online rather than in person? Don&#039;t be! Not only do you receive color selection assistance from our swatch book when shopping for wicker furniture online, but you also are given further customization options if you choose to upgrade to our Sunbrella fabric line. Thanks to such helpful features, shopping for wicker furniture online becomes just as easy as doing so in person. Call <a href='tel:18442728826'>(844) 2-RATTAN</a> or email us at <a href='mailto:sales@rattanoutdoorfurniture.com'>sales@rattanoutdoorfurniture.com</a> to buy wicker furniture online today.</p>",,Wicker Furniture Online,"Wicker, Furniture, Online, furniture, online, Outdoor","Do you want to shop for outdoor products to adorn your space without having to leave your home? Find great wicker furniture online from our company! When you shop for wicker furniture online from our company, we offer you the most extensive selection o...",No,Products only_AND_Static block only,,Yes,,,No layout updates,
