Name,Path,Position,Is Active,Url Key,Description,Image,Page Title,Meta Keywords,Meta Description,Include In Menu,Display Mode,CMS Block,Is Anchor,Availabe Sort By,Default Sort By,Page Layout,Custom Layout Update
Discount Furniture,Default Category/Products,38,No,discount-furniture,"<p>High-end, outdoor rattan discount furniture unites superior craftsmanship with the lowest prices in the business. Enjoy beautifully crafted discount furniture and accessories all while remaining inside your budget. Outdoor rattan discount furniture offers in-stock merchandise ranging from three to nine piece collections to meet all of our customers&#039; needs. Durable rattan outdoor discount furniture incorporates high resilient (HR) foam-seating pillows, DACON wrapped back cushioning coupled with sturdy, rustproof, all-weather frames. Functionally and high-quality comes standard with all of your rattan outdoor discount furniture purchases.</p><p>Are you an owner of a country club, resort or home who is looking for high-quality rattan outdoor discount furniture? Our standard discount furniture can be customized to meet your personal style or match your current decor. Start from the ground up or ask our expertly trained staff, we can work with you to achieve the right design or add contrasting color to any home or hospitality establishment. Whether you&#039;re looking to add personal flare to your deck or an unforgettable welcome to your resort&#039;s front porch, we have the right discount furniture to accentuate your location.</p><p>You can order your rattan discount furniture online today or give us a call at <a href='tel:18442728826'>(844) 2-RATTAN</a>. For all inquiries, send a request to our rapid response email at <a href='mailto:sales@rattanoutdoorfurniture.com'>sales@rattanoutdoorfurniture.com</a>. Discount rattan outdoor furniture and our customer satisfaction are why we continue to lead the market. We are standing by and ready to make you our next satisfied customer.</p>",,Discount Furniture,"Discount, Furniture, Rattan, Outdoor","High-end, outdoor rattan discount furniture unites superior craftsmanship with the lowest prices in the business.",No,Products only_AND_Static block only,,Yes,,,No layout updates,
Discount Outdoor Furniture,Default Category/Products,39,No,discount-outdoor-furniture,"<p>Rattan discount outdoor furniture unites quality outdoor furniture with affordable prices. Enjoy couture sofas, sectionals, and tables without the worry of busting your budget. Turn your outdoor patio into a trip to the tropics with our Tiki dining sets accented in grass green upholstery, or catch an ocean wave on your beach club&#039;s sun deck with our coastal furniture. Discount outdoor furniture incorporates cozy, high-resilient (HR), foam-seating pillows, sturdy rust-proof frames and tightly woven Viro rattan. Exclusive discount outdoor furniture will change with the seasons without the stress of fading or weathering from the elements. There is a discount outdoor furniture set for all seasons because comfort and functionality is our main objection.</p><p>Are you a unique country club, resort, restaurant or home owner looking to customize your rattan outdoor discount furniture? We are available to discuss and assist you in any project you might be starting. Discount outdoor furniture can be customized to meet your style and decor. Start from the ground up with our knowledgeable and expertly trained staff who will guide and work with you to achieve your designing goals.</p><p>Order your rattan discount outdoor furniture today by giving us a call at <a href='tel:18442728826'>(844) 2-RATTAN</a>, or for those pressed for time, send an email to <a href='mailto:sales@rattanoutdoorfurniture.com'>sales@rattanoutdoorfurniture.com</a>. We will have your rattan discount outdoor furniture at your front door in no time.</p>",,Discount Outdoor Furniture,"Discount, Outdoor, Furniture, Rattan",Rattan discount outdoor furniture unites quality outdoor furniture with affordable prices.,No,Products only_AND_Static block only,,Yes,,,No layout updates,
Discount Wicker Furniture,Default Category/Products,40,No,discount-wicker-furniture,"<p>Are you looking to save money on outdoor products? We&#039;re here to help you. Be sure to check out our discount wicker furniture and you&#039;ll relish in the awe that comes with being able to find high-quality products for lower prices. Show off your outdoor discount wicker furniture to friends and family and wear a proud smile when you tell them how much you saved. We have discount wicker furniture available for parties around the pool, sunbathing on the deck, or even to adorn your building&#039;s courtyard.</p><p>All of our discount wicker furniture is hand-woven with high-density, polyethylene RAUCORD resin and constructed from all-weather, 100% powder-coated aluminum frames so that you can rest assured knowing your discount wicker furniture will come to you strong and ready to stay in your collection for years. Enjoy your discount wicker furniture on sunny days and rainy ones, as it will resist damage from the seasonal elements, and our Allure fabric resists UV rays to minimize color fading. However, you may also upgrade to our Sunbrella fabric options for your discount wicker furniture if you would like a broader color selection, and you can choose to have the welting contrast the rest of the fabric as well.</p><p>Are tables included in the discount wicker furniture we offer? Of course! Not to mention, all of the tables in our discount wicker furniture selection are made with tempered glass tops for maximum protection. Call us at <a href='tel:18442728826'>(844) 2-RATTAN</a> or send an email to <a href='mailto:sales@rattanoutdoorfurniture.com'>sales@rattanoutdoorfurniture.com</a> to order discount wicker furniture now.</p>",,Discount Wicker Furniture,"Discount, Wicker, Furniture, furniture, Outdoor",Are you looking to save money on outdoor products? We're here to help you.,No,Products only_AND_Static block only,,Yes,,,No layout updates,
Discount Wicker Patio Furniture,Default Category/Products,41,No,discount-wicker-patio-furniture,"<p>Are you on a tight budget and in need of great outdoor products to adorn your space with? Our company supplies discount wicker patio furniture that gives you five-star outdoor products at a reduced price so that you can still obtain what you need and not be left with financial regret. Our assortment of discount wicker patio furniture includes everything from bar stools to porch swings to chairs, so you&#039;re sure to find what you&#039;re looking for.</p><p>If you&#039;re worried about finding discount wicker patio furniture that is still high in aesthetic appeal, fear no more! We don&#039;t think that you should have to spend a ridiculous amount of money to have elegant outdoor products, so our master craftsmen indiscriminately weave beauty into every strand of high-density, polyethylene Viro resin that makes up our discount wicker patio furniture. Because the polyethylene prevents damage from the seasonal elements and the slow decay of time, our discount wicker patio furniture maintains its excellent condition so that you&#039;re never getting worn out products. Also contributing to the preservation of our discount wicker patio furniture are the all-weather, powder-coated aluminum frames, which will remain unconditionally supportive and resist rusting.</p><p>Are you still skeptical about finding discount wicker patio furniture that is in superb shape? Abandon all doubts, as even our cushions are made of high-resilience (HR), UV-resistant Allure fabric. Call <a href='tel:18442728826'>(844) 2-RATTAN</a> or email us at <a href='mailto:sales@rattanoutdoorfurniture.com'>sales@rattanoutdoorfurniture.com</a> to order discount wicker patio furniture now.</p>",,Discount Wicker Patio Furniture,"Discount, Wicker, Patio, Furniture, wicker, patio, furniture, Outdoor",Are you on a tight budget and in need of great outdoor products to adorn your space with? Our company supplies discount wicker patio furniture that gives you five-star outdoor products at a reduced price so that you can still obtain what you need and n...,No,Products only_AND_Static block only,,Yes,,,No layout updates,
Discount Wicker Sofas,Default Category/Products,42,No,discount-wicker-sofas,"<p>Discover the exclusive class of our unique outdoor furniture without the worry of over paying with our discount wicker sofas. Our selection of in-stock discount wicker sofas display true craftsmanship with 100% hand-woven Viro resin strands tightly fitted to our light-weight, powder-coated, aluminum frames. Discount wicker sofas are made to last beyond the life of our competitor&#039;s products because we use the industry&#039;s top rated materials. Look at our wicker and fabric samples online or have them sent right to your home to see firsthand the durability and style found on our discount wicker sofas. Share your memories of the coast with our discount wicker sofas tailored in blue and white striped fabric or embrace the American dream with optional DACRON wrapped back cushioning. From summer to spring, our outdoor discount wicker sofas will remain on your patio, ready to offer you comfortable contoured seating.</p><p>Our company&#039;s discount wicker sofas will have you enjoying the outdoors like never before. Complete your patio living area by adding our charming accessories or purchasing an ottoman to really kick back. All of our outdoor furniture is prices at the lowest prices on the market, guaranteed. We have made a promise to save you money, and it&#039;s clear to see we keep our promises with our quality and stylish discount wicker sofas.</p><p>Order your outdoor discount wicker sofas today simply by clicking the &quot;buy now&quot; tab or you can call us at <a href='tel:18442728826'>(844) 2-RATTAN</a>. Send an email with all your discount wicker sofas inquiries to <a href='mailto:sales@rattanoutdoorfurniure.com'>sales@rattanoutdoorfurniure.com</a>.</p>",,Discount Wicker Sofas,"Discount, Wicker, Sofas, Outdoor, Furniture",Discover the exclusive class of our unique outdoor furniture without the worry of over paying with our discount wicker sofas.,No,Products only_AND_Static block only,,Yes,,,No layout updates,
End Tables,Default Category/Products,43,Yes,end-tables,"<p>Add versatility and style to your patio, deck, or poolside with our one-of-a-kind rattan outdoor end tables. Place end tables on either side of your couch and their sleek design will complement your living room, or place one outside by your sectional and our end tables will offer a nice resting spot for your favorite magazine. Place your favorite plant atop your end tables and greet guests with your vibrant green display. Look for soft golden finishes or dark solid colors. Rattan end tables will fit neatly underneath a bay window or graciously by your grill. The sturdy furniture frame will stabilize all lighting and decor. The outdoors have never felt more cozy with furniture end tables arranged and then rearranged with ease.</p><p>Rattan outdoor end tables furniture pieces are completed with our low-maintenance tempered glass tops, which only reflect style and class. Our glass is made with extra strength so your heaviest of vases will sit nicely atop. Place your rattan tables outside and don&rsquo;t worry about the weather conditions depleting their value. Our outdoor finishes are UV and water resistant. Our aluminum frames are powder-coated to remain rust-free while our rattan end tables state your desire for fashion and longevity.</p><p>Rattan outdoor end tables furniture can be yours today by calling us at <a href='tel:18442728826'>(844) 2-RATTAN</a> or emailing us at <a href='mailto:sales@rattanoutdoorfurniture.com'>sales@rattanoutdoorfurniture.com</a>. We want to put a smile on your face while you feature our quality end tables and furniture in your home.</p>",accessories.jpg,End Tables,"End, Tables, Rattan, Outdoor, Furniture","Add versatility and style to your patio, deck, or poolside with our one-of-a-kind rattan outdoor end tables.",No,Products only_AND_Static block only,,Yes,,,No layout updates,
Essentials,Default Category/Products,44,Yes,essentials,"<p>How can you bring even more luxury to your patio or porch with unsurpassed rattan and wicker essentials? Our outdoor essentials will bring additional class to your home, from hampers to lighting and umbrellas, the choices are endless. All of your potted plants can proudly be displayed nestled in our essentials planters. Accommodating rattan essentials, are crafted with the same innovating techniques used on our outdoor furniture. Master artisans carefully piece each Viro resin rattan strand together to create cherished essentials that will remain durable throughout the years. Timelessly pleasing essentials are designed to coincide with all of our products. Our sectionals pair nicely under cantilever umbrellas shading you from the summer heat, and all dining sets will be glowing under the bright illumination of rattan lighting. Go beyond accessorizing and connect your home with personality and style by applying top-grade essentials to your outdoors.</p><p>Essentials are not just for personal homes, we specialize in orders for hotels, restaurants, designers and dealers. Speak with one of our knowledgeable customer care representatives and ask for details about how you can quickly add class to your country club&#039;s patio with practical essentials. Place our hanging baskets above every bistro table or accent your resort&#039;s pool area with elegant flower pots. Tailor each piece to blend into your surroundings or purchase our superb in-stock outdoor essentials, ready for quick shipping.</p><p>Order your rattan outdoor essentials and furniture online now or call our toll-free number at <a href='tel:18442728826'>(844) 2-RATTAN</a>. Contact our furniture sales team 24-hours a day by email, <a href='mailto:sales@rattanoutdoorfurniture.com'>sales@rattanoutdoorfurniture.com</a>.</p>",accessories.jpg,Essentials,"Essentials, Outdoor, Patio, Furniture, Rattan","How can you bring even more luxury to your patio or porch with unsurpassed rattan and wicker essentials? Our outdoor essentials will bring additional class to your home, from hampers to lighting and umbrellas, the choices are endless.",No,Products only_AND_Static block only,,Yes,,,No layout updates,
Faux Rattan,Default Category/Products,45,No,faux-rattan,"<p>You will see the craftsmanship and eminence detail in each faux rattan strand woven into your outdoor furniture. Low-maintenance and weatherproofing power, our faux rattan is made from the highly sought after synthetic, high-density polyethylene, Viro resin. Maintain the look of natural rattan without the maintenance and inhibit color fading on all of your outdoor furniture. Faux rattan will not weather and prevents moisture from being absorbed and never again worry about seasonal painting, sealing or staining, because with our outdoor furniture these menial tasks are never required. With faux rattan, our company&#039;s products last for years past our competitors and will standup to the most extreme of weather conditions. Faux rattan has proven longevity along with stunning style and class.</p><p>Rattan Outdoor Furniture realizes faux rattan samples are critical to your purchase, and knowing what quality outdoor furniture we offer, is vital to transforming your patio or deck. That is why we are proud to offer faux rattan samplings available both online and in tangible weaves sent right to your home. For designers and dealers, our faux rattan samples enable your clients to feel and see our superior products. Rattan Outdoor Furniture is positive, once you have seen our faux resin, you will become another satisfied customer.</p><p>Order your faux rattan outdoor furniture or samples online today or call us at <a href='tel:18442728826'>(844) 2-RATTAN</a> and email your faux rattan questions to <a href='mailto:sales@rattanoutdoorfurniture.com'>sales@rattanoutdoorfurniture.com</a>.</p>",,Faux Rattan,"Faux, Rattan, Outdoor, Furniture",You will see the craftsmanship and eminence detail in each faux rattan strand woven into your outdoor furniture.,No,Products only_AND_Static block only,,Yes,,,No layout updates,
Faux Wicker,Default Category/Products,46,No,faux-wicker,"<p>Experience the master craftsmanship of our exquisite faux wicker furniture made with innovating techniques. Low-maintenance and constructed with ultimate weatherproofing power, our faux wicker is made from the highly sought after synthetic, high-density polyethylene, Viro resin. Our faux wicker furniture&rsquo;s natural appearance comes without the upkeep and inhibits color fading. Faux wicker does not easily weather and prevents all moisture from being absorbed. Never again worry about seasonal painting, sealing or staining because with our faux wicker outdoor furniture these menial tasks are never required. With faux wicker, our company&#039;s products last for years past our competitors and will standup to the most extreme of weather conditions. We also offer the best warranties on the market on every faux wicker furniture purchase. Faux wicker has proven longevity and stunning style can indeed be merged to perfection.</p><p>Our company realizes faux wicker samples are critical to your purchase and knowing what quality outdoor furniture we offer, is vital to transforming your patio or deck. That is why we offer faux wicker samples available both online and in tangible weaves sent right to your home. For designers and dealers, our faux wicker samples enable your clients to feel and see our superior products. With each faux wicker outdoor furniture purchase, we promise our customer satisfaction always comes standard.</p><p>Order your faux wicker outdoor furniture or samples online today or call us at <a href='tel:18442728826'>(844) 2-RATTAN</a> and email your questions to <a href='mailto:sales@rattanoutdoorfurniture.com'>sales@rattanoutdoorfurniture.com</a>.</p>",,Faux Wicker,"Faux, Wicker, Outdoor, Furniture",Experience the master craftsmanship of our exquisite faux wicker furniture made with innovating techniques.,No,Products only_AND_Static block only,,Yes,,,No layout updates,
Furniture Clearance,Default Category/Products,47,No,furniture-clearance,"<p>How much selection will you find when browsing through our rattan outdoor patio furniture clearance? Our rattan outdoor furniture clearance spans a full ray of sofas, low-maintenance tempered glass topped tables as well as sectionals and chairs. We update our affordable furniture clearance as we make room for more models. Browse through our selection of customized Viro resin finished furnishings or our in-stock quality rattan furniture clearance options. Each piece from found through our furniture clearance is awe-inspiring for any patio, porch or poolside. Mix and match cushion colors and add little accents like hand-woven accessories. We want each uniquely crafted furniture clearance piece to reflect your inner designer, that&#039;s why the variations are endless.</p><p>With our rattan furniture clearance, each item is made from the same reliable and water resistant, all-weather, powder-coated, high-grade aluminum frames. Our exclusive Allure fabric comes standard with our high resilient (HR) foam seating cushioning and will not fade in the sun or form absorb moisture. Patio furniture clearance products go beyond ordinary outdoor tables and chairs and into high-end luxury. Look for our vinyl furniture covers to provide extra protect to all of your outdoor furnishings and then add our beneficial warranties.</p><p>Have questions about our rattan outdoor patio furniture clearance items? We always have answers at <a href='tel:18442728826'>(844) 2-RATTAN</a>. Our fast response email is also available at, <a href='mailto:sales@rattanoutdoorfurniture.com'>sales@rattanoutdoorfurniture.com</a>. We want to get you one step closer to creating your own outdoor haven at discount prices with our company&#039;s premier furniture clearance collection.</p>",,Furniture Clearance,"Furniture, Clearance, Outdoor, Rattan, Patio","How much selection will you find when browsing through our rattan outdoor patio furniture clearance? Our rattan outdoor furniture clearance spans a full ray of sofas, low-maintenance tempered glass topped tables as well as sectionals and chairs.",No,Products only_AND_Static block only,,Yes,,,No layout updates,
Furniture Collections,Default Category/Products,48,No,furniture-collections,"<p>Going beyond the ordinary, outdoor rattan furniture collections convey the perfect outdoor oasis. Our furniture collections combine luxury, strength, and innovative crafting techniques, enabling powder-coated aluminum frames and high resilience (HR) cushions to withstand the harshest of weather conditions. Keeping vibrant colors, our quality furniture collections are equipped with outdoor, fade resistant, Viro rattan resin. From your personal patio to apartment living, our wide selection of styles and colors allows our furniture collections to fit any environment. Furniture collections and accessories are combined to make stylish, all-weather sets sure to fulfill every outdoor corner.</p><p>Remember that rattan furniture is just the beginning of building prominent outdoor collections. We have accessories to augment your outdoor haven and greet guests with a touch of heart. Shelter your furniture from the hot summer sun with our fade resistant umbrellas, available in our rattan furniture collections accessory line. Plant your favorite flowers around our furniture collections and accent each piece with hand-woven accessories. Create the perfect rattan outdoor furniture collections in your home, hotel, or country club by seamlessly arranging our furniture and accessories together.</p><p>Rattan furniture collections will transform your back yard into an extension of your home. All of our representatives are trained to address your inquiries and quickly process orders. Become a proud owner of our eye-catching furniture collections today by calling <a href='tel:18442728826'>(844) 2-RATTAN</a> or emailing us at <a href='mailto:sales@rattanoutdoorfurniture.com'>sales@rattanoutdoorfurniture.com</a>.</p>",,Furniture Collections,"Furniture, Collections, rattan, outdoor","Going beyond the ordinary, outdoor rattan furniture collections convey the perfect outdoor oasis.",No,Products only_AND_Static block only,,Yes,,,No layout updates,
Furniture Direct,Default Category/Products,49,No,furniture-direct,"<p>Rattan outdoor furniture direct means you&#039;re getting the best deals on all of your outdoor furniture and accessories. We want your house to extend past its four walls and onto your lawn at a price you can afford. Furniture direct is the way for the everyday family to acquire high-end pieces because we have furniture direct prices for any budget. Find luxurious sofas and stylish outdoor tables that are yours for the picking at our furniture direct savings. From our sectionals to our umbrellas, each discounted furniture direct piece is constructed to look brand new even years down the line and our powder-coated, aluminum frames will hold to unpredictable weather conditions. From summer to winter, you&#039;ll want to display your furniture direct products all year round. You won&#039;t be disappointed when you see the selection of finishes and colors customized for each individual home with our rattan outdoor furniture direct collections.</p><p>Outdoor rattan furniture direct is even more of a bargain for designers, hospitality owners, and dealers. We offer the lowest price on the market for all of our furniture direct products. From large sofas to the smallest of baskets, each piece is sure to please your toughest critics. We are ready to aid you now with all of your rattan outdoor furniture direct purchases. Call us today at <a href='tel:18442728826'>(844) 2-RATTAN</a> or send us an email at <a href='mailto:sales@rattanoutdoorfuriture.com'>sales@rattanoutdoorfuriture.com</a> and we will answer all of your burning questions.</p>",,Furniture Direct,"Furniture, Direct, Rattan, Outdoor",Rattan outdoor furniture direct means you're getting the best deals on all of your outdoor furniture and accessories.,No,Products only_AND_Static block only,,Yes,,,No layout updates,
