Name,Path,Position,Is Active,Url Key,Description,Image,Page Title,Meta Keywords,Meta Description,Include In Menu,Display Mode,CMS Block,Is Anchor,Availabe Sort By,Default Sort By,Page Layout,Custom Layout Update
Modular Furniture,Default Category/Products,75,Yes,modular-furniture,"<p>How can your patio, porch or poolside reflect high-end luxury with the placement of top-grade outdoor modular furniture? When you arrange unsurpassed modular furniture around your decks, porches, yards, and verandas, you create the ultimate area for socialization or solitude. Guests will be amazed by how practical and aesthetically pleasing your affordable modular furniture actually is as we sell our patio furniture sets at the lowest prices in the industry.</p><p>Bring the natural look of outdoor patio modular furniture without the upkeep of natural rattan. Low maintenance modular furniture is built to withstand the harshest of seasonal elements and refrain from discoloration, fading or moisture absorption. The strength and reliability of our durable modular furniture is due to hand-woven high-density polyethylene Viro resin strands that have crafted with diligence by our master craftsmen. Each modular furniture piece is also supported by all-weather powder-coated aluminum frames.</p><p>Quality outdoor modular furniture offer comfortable contoured seating with welting on the cushions that you can choose to have match or contrast. Our company&#039;s uses superior high indentation load deflection (ILD) foam cushioning to provide the utmost of comfort. The fabric of the cushioning for our outdoor modular furniture is made from our exclusive Allure line, that is designed to minimizes color fading with UV inhibiting materials. How can you order rattan outdoor modular furniture from our company now? Browse through our online shop or receive assistance by phone at <a href='tel:18442728826'>(844) 2-RATTAN</a>. Rattan modular furniture questions can be answered through email at <a href='mailto:sales@rattanoutdoorfurniture.com'>sales@rattanoutdoorfurniture.com</a>.</p>",,Modular Furniture,"Modular, Furniture, Rattan, Outdoor, Patio","How can your patio, porch or poolside reflect high-end luxury with the placement of top-grade outdoor modular furniture? When you arrange unsurpassed modular furniture around your decks, porches, yards, and verandas, you create the ultimate area for so...",No,Products only_AND_Static block only,,Yes,,,No layout updates,
Modular Seating,Default Category/Products,76,No,modular-seating,"<p>Looking for dynamic rattan modular seating to accentuate your surroundings? We offer the lowest prices on the market along with exquisite, handcrafted designs on all of our modular seating. Constructed from eco-friendly materials our modular seating has the maximum strength of powder-coated aluminum frames and durable RAUCORD resin. Our modular seating uses rattan resin that is 100% hand-woven with the latest techniques by master artisans who skillfully weave all of our modular seating into unique masterpieces. From our resin to our Allure fabric only found through our company, we use the latest technology advancement in outdoor furniture so your modular seating will last years beyond any of our competitors products. Do you like our modular seating but are still looking for another line of cushioning? Not a problem, we offer our customers customization options for their modular seating such as Sunbrella fabrics, contrasting welting and decorative trims.</p><p>We promise to keep every customer satisfied with their rattan modular seating purchase. By owning and manufacturing our modular seating, we know the incomparable quality found in all of our rattan outdoor furniture products. Our rattan outdoor modular seating can be purchase simply by clicking the &quot;buy now&quot; tab or calling us at <a href='tel:18442728826'>(844) 2-RATTAN</a>. Our highly-trained sales representatives can talk you through your modular seating order and always have answers to all of your questions. Send an email to <a href='mailto:sales@rattanoutdoorfurniure.com'>sales@rattanoutdoorfurniure.com</a> and we will contact you promptly.</p>",,Modular Seating,"Modular, Seating, Outdoor, Furniture, Rattan","Looking for dynamic rattan modular seating to accentuate your surroundings? We offer the lowest prices on the market along with exquisite, handcrafted designs on all of our modular seating.",No,Products only_AND_Static block only,,Yes,,,No layout updates,
Nautical Furniture,Default Category/Products,77,No,nautical-furniture,"<p>The spirit of riding the ocean waves is waiting for you on our rattan outdoor nautical furniture. Whether you&#039;re furnishing your house, cruise line or yacht club, we have discounted nautical furniture priced for you. Choose from our wide array of nautical themed fabric and finishes available in all different shades, go from blues and white stripes to a solid burst of color. Spend nights on your patio&#039;s nautical furniture dreaming of a star stretch journey while riding the wide open seas. Country club patrons will envision themselves on a yacht while they&#039;re sipping ice tea on our outdoor rattan nautical furniture sets. Your backyard will transport you to the leisure of the soft Atlantic waves once you purchase our rocking chairs and complete you rattan nautical furniture collection with an umbrella made from sturdy Sunbrella fabric.</p><p>Outdoor rattan nautical furniture goes beyond style with durable, all-weather, powder-coated, high-grade, aluminum frames and the tightly 100% hand-woven Viro resin. Our exclusive Allure fabrics add color to your nautical furniture as well as provide premium protection. Colors won&#039;t fade to the sun, enabling your top-rate nautical furniture to stand up to the test of time. Rattan outdoor nautical furniture can be yours today by contacting our friendly and knowledgeable team at <a href='tel:18442728826'>(844) 2-RATTAN</a> or send us a quick email at <a href='mailto:sales@rattanoutdoorfurniture.com'>sales@rattanoutdoorfurniture.com</a>. We pride ourselves in a quick and informative response time.</p>",,Nautical Furniture,"Nautical, Furniture, Rattan, Outdoor",The spirit of riding the ocean waves is waiting for you on our rattan outdoor nautical furniture.,No,Products only_AND_Static block only,,Yes,,,No layout updates,
Nautical Wicker Furniture,Default Category/Products,78,No,nautical-wicker-furniture,"<p>Whether you&#039;re furnishing your house, cruise line or yacht, we have discounted nautical wicker furniture collections priced at the lowest discounts on the market. Choose from a wide array of nautical themed fabric and finishes available in all different shades, go from blues and white stripes to a solid burst of color. Spend nights on your patio&#039;s nautical wicker furniture dreaming of life on the sea. Country club patrons will envision themselves on a yacht while they&#039;re sipping ice tea on our outdoor nautical wicker furniture sets. Your backyard will transport you to the leisure of the soft Atlantic waves once you purchase our gliders and complete you nautical wicker furniture collection with an umbrella made from sturdy Sunbrella fabrics. The spirit of riding the ocean waves is waiting for you on our outdoor nautical wicker furniture.</p><p>Outdoor nautical wicker furniture goes beyond style with durable, all-weather, powder-coated, high-grade aluminum frames and the tightly 100% hand-woven Viro resin. Our exclusive Allure fabrics color your nautical wicker furniture as well as provide premium protection. Colors won&#039;t fade to the sun or absorb moisture, enabling your top-rated nautical wicker furniture to stand up to the test of time. Our outdoor nautical wicker furniture can be yours today by contacting our friendly and knowledgeable team at <a href='tel:18442728826'>(844) 2-RATTAN</a> or send us a quick email to <a href='mailto:sales@rattanoutdoorfurniture.com'>sales@rattanoutdoorfurniture.com</a>. We pride ourselves in a quick and informative response to all of your nautical wicker furniture questions.</p>",,Nautical Wicker Furniture,"Nautical, Wicker, Furniture, Outdoor","Whether you're furnishing your house, cruise line or yacht, we have discounted nautical wicker furniture collections priced at the lowest discounts on the market.",No,Products only_AND_Static block only,,Yes,,,No layout updates,
Occasional Furniture,Default Category/Products,79,Yes,occasional-furniture,"<p>Take one look at our rattan outdoor furniture and you will definitely see why we continue to lead the market. Our high-quality furniture is priced at rock bottom prices. Our furniture designed with our very own exclusive Allure fabric, which won&#039;t fade in the sun or warp in the rain. Our synthetic Viro resin is crafted for low-maintenance and all-weather protection while being firmly fastened to our powder-coated, high-grade aluminum frames. However, durability is just the beginning as you browse through our online swatch book and find the perfect combination of color and fashion. Add contrasting welting and cushioning to all of your pillows or go for a traditional blending of neutral colorings. Celebrate the joy of the outdoors all-year-round, and discover what all of our customers already have, that our rattan outdoor furniture makes your yard extraordinary.</p><p>Your satisfaction is what keeps us growing as a company and makes rattan outdoor furniture a prized presentation for any home, hotel, restaurant or yacht club. Our expertly trained staff is willing to answer all of your rattan outdoor furniture questions and assist you in making an online purchase. We offer quick shipping options with in-stock furniture orders, or you can customize each furniture piece online.</p><p>We are happy to take your call today at <a href='tel:18442728826'>(844) 2-RATTAN</a> or email us all of your rattan outdoor furniture inquiries at <a href='mailto:sales@rattanoutdoorfurniture.com'>sales@rattanoutdoorfurniture.com</a>. Whether you&#039;re ordering online or on the phone, we want every furniture transaction to be satisfactory.</p>",,Occasional Furniture,"Occasional, Furniture, Rattan, Outdoor",Take one look at our rattan outdoor furniture and you will definitely see why we continue to lead the market.,No,Products only_AND_Static block only,,Yes,,,No layout updates,
Outdoor Balcony Furniture,Default Category/Products,80,No,outdoor-balcony-furniture,"<p>Expand the comfort and style of your balcony with our exquisite rattan outdoor balcony furniture collection. Create an inviting contemporary space on your hotel&#039;s balcony and give your guests just another reason to return. Our selection of outdoor balcony furniture is crafted in bold intricate designs. Solid and patterned optional Sunbrella fabrics come in shades and tints spanning the rainbow. Choose from our standard Allure fabrics which resist moisture absorption and inhibits color fading. Welcome in guests with rattan outdoor balcony furniture lighting their way to sophistication and class. Draw in a romantic touch on your balcony with intimate lounge chairs arranged around a low maintenance outdoor table. Outdoor balcony furniture is durable and reliable with our frames supported by all high-density, powder-coated, high-grade, aluminum frames and our all-weather protection Viro resin. Adorn every corner of your house, resort or restaurant with our reliable and exquisite outdoor balcony furniture sets and live a life of luxury.</p><p>Rattan outdoor balcony furniture is right at your fingertips when you order our fabric and resin samples. See firsthand the quality built into every outdoor balcony furniture set and feel confident in your purchase. Browse our online swatch book and discover your perfect shade of red to incorporate glamour onto your deck or poolside. We make buying outdoor balcony furniture easy and accessible to every customer.</p><p>We answer all rattan outdoor balcony furniture inquiries with live in-house staff members. Call us today at <a href='tel:18442728826'>(844) 2-RATTAN</a> or send an email to <a href='mailto:sales@rattanoutdoorfurniture.com'>sales@rattanoutdoorfurniture.com</a>.</p>",,Outdoor Balcony Furniture,"Outdoor, Balcony, Furniture, Rattan",Expand the comfort and style of your balcony with our exquisite rattan outdoor balcony furniture collection.,No,Products only_AND_Static block only,,Yes,,,No layout updates,
Outdoor Balcony Patio Sets,Default Category/Products,81,No,outdoor-balcony-patio-sets,"<p>Discover the serenity of the natural world by purchasing our outdoor balcony patio sets with the ordinary look of rattan without the maintenance. Our RAUCORD resin strands are intricately woven into perfection with all-weather protection and fade resistant technology. Items in our superior outdoor balcony patio sets are made from sturdy, rustproof, aluminum frames and Allure covered cushions with color that remains bright while inhibiting seasonal damage. Unique rattan outdoor balcony patio sets go beyond tables and chairs and into top-of-the-line sectionals, sofas and coffee tables along with handcrafted accessories. Glance at the options in our outdoor balcony patio sets accessory line and discover how easy it is to accentuate your balcony with unique lighting and sun shading umbrellas.</p><p>Offering quality and discounts, our rattan outdoor balcony patio sets are marked at the lowest prices on the market because selling quality outdoor balcony patio sets at rates everyone can afford is our top-priority. Finding a piece from our rattan patio sets awakes your inner designer with our optional Sunbrella fabric line. Purchasing outdoor balcony patio sets through Rattan Outdoor Furniture means you can quickly and easily browse through our large selection. Search our website and quickly obtain your completed outdoor balcony patio sets in no time at all. Our certified customer service representatives are always available to assist in all of your rattan furniture needs. Dial <a href='tel:18442728826'>(844) 2-RATTAN</a> or send an email to <a href='mailto:sales@rattanoutdoorfurniture.com'>sales@rattanoutdoorfurniture.com</a>, and we&#039;ll get you started on obtaining your outdoor balcony patio sets today.</p>",,Outdoor Balcony Patio Sets,"Outdoor, Balcony, Patio, Sets, Rattan, Furniture",Discover the serenity of the natural world by purchasing our outdoor balcony patio sets with the ordinary look of rattan without the maintenance.,No,Products only_AND_Static block only,,Yes,,,No layout updates,
Outdoor Chairs,Default Category/Products,82,Yes,outdoor-chairs,"<p>Both beautiful and durable, our outdoor chairs are sure to bring individualized life to your patio. Our company&#039;s all-weather outdoor chairs save you the worries of tomorrow by using the industry&#039;s top-rated materials. Rather than stressing about the elements, enjoy a refreshing afternoon nap on our deep seated outdoor chairs. Our finishes are made to last, and you can customize our outdoor chairs in a variety of shades. Rattan outdoor chairs coincide with each of our vibrant Allure fabric choices. Just like our finishes, our fabric selection is full of options spanning the color wheel. Choose outdoor chairs to perfectly match your deck or patio or choose a complementary color to add to your existing decor. Discover the convenience of our online swatch book while mixing and matching Allure fabric with Viro resin finishes. Whether your backdrop is the ocean waves or among city skyscrapers, there are unique outdoor chairs to fit your personal style.</p><p>With our affordable rattan outdoor chairs, your patio will shine in the sun and blend into the shade. There are rattan outdoor chairs ready for your order today or you can get samples and learn more about our product by browsing our website. Call us now to learn more about customizing your outdoor chairs and ask our representatives about the many options available. Rattan Outdoor Furniture is ready for your call at, <a href='tel:18442728826'>(844) 2-RATTAN</a> or send an email to, <a href='mailto:sales@rattanoutdoorfurniture.com'>sales@rattanoutdoorfurniture.com</a>. Our well-versed staff is waiting to confirm your rattan outdoor chairs order today.</p>",,Outdoor Chairs,"Outdoor, Chairs, chairs, Rattan, Furniture","Both beautiful and durable, our outdoor chairs are sure to bring individualized life to your patio.",No,Products only_AND_Static block only,,Yes,,,No layout updates,
Outdoor Essentials,Default Category/Products,83,Yes,outdoor-essentials,"<p>Go beyond rattan furniture and accent your outdoors with our impressive outdoor essentials. Outdoor essentials welcome pop onto your patio, from lighting shades and umbrellas to hampers and storage chests, you&#039;re options are limitless. Showcase your potted flowers proudly planted deeply into our planters. Rattan outdoor essentials, are crafted with the materials as our unrelenting rattan furniture sets. Our craftsmen carefully weave each Rehau rattan resin strand tightly to create one-of-a-kind outdoor essentials that will not snap, break or splinter. Our outdoor essentials are designed to coincide with all of our products. Our sofas pair neatly beneath cantilever umbrellas providing shade from the hot summer sun, and all conversation sets will be highlighted under the glow of our rattan lighting.</p><p>Our outdoor essentials are not just for residential uses because we cater to all-large volume orders placed by hotels, resorts, designers and cafes. Discuss your needs with one of our well-qualified operators and ask for information on how you can gain access to our full line of outdoor essentials. Accentuate your restaurant tables with hanging baskets or bring life to your resort&#039;s poolside with decadent flower pots. Our outdoor essentials can be tailored to highly your natural surroundings or purchase our premier outdoor essentials, always ready for quick shipping.</p><p>Order your rattan outdoor essentials online now or call our toll-free number at <a href='tel:18442728826'>(844) 2-RATTAN</a>. You can also contact us via our email, <a href='mailto:sales@rattanoutdoorfurniture.com'>sales@rattanoutdoorfurniture.com</a>.</p>",accessories.jpg,Outdoor Essentials,"Outdoor, Essentials, Furniture, Rattan",Go beyond rattan furniture and accent your outdoors with our impressive outdoor essentials.,No,Products only_AND_Static block only,,Yes,,,No layout updates,
Outdoor Furniture,Default Category/Products,84,Yes,outdoor-furniture,"<p>Rattan outdoor furniture has luxury and durability you can rely on. Adding serenity to the outdoors has just become a little easier, as our outdoor furniture is the perfect way to enjoy nature without the worry of seasonal weathering. All year long, our outdoor furniture has a sturdy, powder-coated aluminum frame standing up to all of the weather elements. Our Viro resin strands have been handcrafted with quality and care, ensuring your rattan outdoor furniture will last throughout the hands of time. The comfort and style of the quick-drying and fade resistant cushions are just as durable as the frame itself. Outdoor furniture is developed by master craftsmen and is SGS tested and approved.</p><p>Rattan outdoor furniture will meet all of your outdoor furniture wants and needs. Add a lounge chair or loveseat and you have just made an outside living room. Your outdoor furniture provides a place of quiet relaxation or a space to share a fond moment with friends. Remember that all outdoor furniture purchases can be completed by adding a worry-free warranty. Order our extraordinary outdoor furniture today and receive the lowest price available.</p><p>Our knowledgeable staff is waiting right for your call now and can provide you with more product details and answer all your questions. We can assist you with your rattan outdoor furniture needs if you call us at <a href='tel:18442728826'>(844) 2-RATTAN</a> or emailing us at <a href='mailto:sales@rattanoutdoorfurniture.com'>sales@rattanoutdoorfurniture.com</a> today.</p>",products.jpg,Outdoor Furniture,"Outdoor, Furniture, Rattan",Rattan outdoor furniture has luxury and durability you can rely on.,No,Products only_AND_Static block only,,Yes,,,No layout updates,
Outdoor Furniture Clearance,Default Category/Products,85,No,outdoor-furniture-clearance,"<p>Our rattan outdoor furniture clearance spans a full ray of sofas, low-maintenance tempered glass topped tables as well as sectionals and chairs. We update our outdoor furniture clearance as we make room for more models. Browse through our selection of customized Viro resin finished furnishings or our in-stock quality rattan outdoor furniture clearance options. Each piece from our outdoor furniture clearance is inspired by you. Mix and match cushion colors and add little accents like our 100% hand-woven accessories. We want each outdoor furniture clearance piece to reflect your inner designer, that&#039;s why the variations are endless.</p><p>With our rattan outdoor furniture clearance, each item is made from the same sturdy and rustproof, all-weather, powder-coated, high-grade aluminum frames. Our exclusive Allure fabric comes standard with our high resilient (HR) foam seating cushioning and will not fade in the sun or form mold or mildew under the elements. Our outdoor furniture clearance products go beyond tables and chairs. Look for our vinyl furniture covers to provide extra protect to all of your outdoor furnishings and then add our beneficial warranties.</p><p>Have questions about our rattan outdoor furniture clearance items? We always have answers at <a href='tel:18442728826'>(844) 2-RATTAN</a>. Our fast response email is also available at, <a href='mailto:sales@rattanoutdoorfurniture.com'>sales@rattanoutdoorfurniture.com</a>. We want to get you one step closer to creating your own outdoor haven at discount prices with our rattan outdoor furniture clearance collection.</p>",,Outdoor Furniture Clearance,"Outdoor, Furniture, Clearance, Rattan","Our rattan outdoor furniture clearance spans a full ray of sofas, low-maintenance tempered glass topped tables as well as sectionals and chairs.",No,Products only_AND_Static block only,,Yes,,,No layout updates,
Outdoor Furniture Retailers,Default Category/Products,86,No,outdoor-furniture-retailers,"<p>Rattan outdoor furniture retailers offer quality lawn, patio, resort, hotel and country club decor. We are indirect contact with our outdoor furniture retailers, double checking each rattan strand and ensuring our furniture maintains its excellence. We keep all of our customers satisfied by having our outdoor furniture retailers provide handcrafted sofas, dining sets and sectionals designed for low-maintenance and all-weather protection. Our resin is made from Viro high-density, polyethylene and sustains its vibrant appearance longer than the competition. Our outdoor furniture retailers work hard so your furniture will continue to last for years to come. Our rustproof, powder-coated aluminum frames are resistant to the weather elements, and clearly show that we take pride in all of our products. With high-resilient (HR) foam-cushioning wrapped in Allure fabric, our outdoor furniture retailers only sell premium rattan furniture.</p><p>We have searched the world over for the best rattan outdoor furniture retailers to deliver you environmentally friendly products. Our outdoor furniture retailers send forth the best options in outdoor living and offer amazing options for your patios, decks and yards. From our sofas to our umbrellas, there is not a product sold by our rattan outdoor furniture retailers which we would not want in our own homes. Give us a call today and discover what we have, as our outdoor furniture retailers are the best in the business.</p><p>Call us at <a href='tel:18442728826'>(844) 2-RATTAN</a> to have all your rattan outdoor furniture retailers questions answered or to order your outdoor furniture today. We also respond promptly to all emails sent to <a href='mailto:sales@rattanoutdoorfurniture.com'>sales@rattanoutdoorfurniture.com</a>.</p>",,Outdoor Furniture Retailers,"Outdoor, Furniture, Retailers, Rattan","Rattan outdoor furniture retailers offer quality lawn, patio, resort, hotel and country club decor.",No,Products only_AND_Static block only,,Yes,,,No layout updates,
